{
  "$schema": "./schema.json",
  "id": "keychron-q6-pro-ansi-knob",
  "name": "Keychron Q6 Pro ANSI Knob",
  "vendorId": 13364,
  "productIds": [1632],
  "usagePage": 65376,
  "usage": 97,
  "ledCount": 108,
  "characterMap": {
    "1": 21, "2": 22, "3": 23, "4": 24, "5": 25, "6": 26, "7": 27, "8": 28, "9": 29, "0": 30,
    "q": 42, "w": 43, "e": 44, "r": 45, "t": 46, "y": 47, "u": 48, "i": 49, "o": 50, "p": 51,
    "a": 63, "s": 64, "d": 65, "f": 66, "g": 67, "h": 68, "j": 69, "k": 70, "l": 71,
    "z": 79, "x": 80, "c": 81, "v": 82, "b": 83, "n": 84, "m": 85,
    "-": 31, "=": 32, "[": 52, "]": 53, "\\": 54, ";": 72, "'": 73, "\n": 74, ",": 86, ".": 87, "/": 88, " ": 98
  },
  "randomKeys": [21,22,23,24,25,26,27,28,29,30,42,43,44,45,46,47,48,49,50,51,63,64,65,66,67,68,69,70,71,79,80,81,82,83,84,85,86,87,88,98]
}
